{
  "schema_version": "1.0-remix",
  "seed": 4123,
  "source_asset_id": "sha256:7b23204717e1f114ebb25821ba4847416af336278fc0ee22275481d330950427",
  "sample_rate": 48000,
  "source": {"sha256": "7b23204717e1f114ebb25821ba4847416af336278fc0ee22275481d330950427", "original_rate": 48000, "original_frames": 233376, "processed_frames": 233376, "kind": "recorded", "consent_confirmed": true},
  "tempo_milli_bpm": 96000,
  "ticks_per_quarter": 960,
  "time_signature": [4, 4],
  "target_bars": 12,
  "tail_ms": 2000,
  "strategy": "hiphop",
  "key": {"tonic_midi": 62, "mode": "minor"},
  "mix": {"master_target_peak_dbfs": -1, "clean_hook_instrument_duck_db": -16.4781748189, "instrument_room_mix": 0.17999999999999999},
  "analysis": {"peak": 0.263824462890625, "rms": 0.032769265086110097, "normalization_gain": 3.0323192596876809, "pitch_hz": 145.41637505171431, "pitch_confidence": 0.86509470062512572, "onsets": [47520, 56640, 60960, 65760, 71040, 82560, 92160, 98880, 102720, 119520, 124320, 128640, 137280, 145920, 159840], "phrases": [{"start_frame": 46560, "end_frame": 164640, "confidence": 0.65000000000000002}]},
  "sections": [
    {"name": "intro", "start_bar": 0, "bars": 2},
    {"name": "groove", "start_bar": 2, "bars": 4},
    {"name": "break", "start_bar": 6, "bars": 2},
    {"name": "return", "start_bar": 8, "bars": 3},
    {"name": "ending", "start_bar": 11, "bars": 1}
  ],
  "voice_clips": [
    {"id": 0, "start_frame": 0, "end_frame": 233376, "confidence": 1},
    {"id": 1, "start_frame": 46965, "end_frame": 58972, "confidence": 0.29999999999999999},
    {"id": 2, "start_frame": 56134, "end_frame": 76594, "confidence": 0.65000000000000002},
    {"id": 3, "start_frame": 60523, "end_frame": 76594, "confidence": 0.65000000000000002},
    {"id": 4, "start_frame": 65313, "end_frame": 76594, "confidence": 0.65000000000000002},
    {"id": 5, "start_frame": 70647, "end_frame": 77055, "confidence": 0.65000000000000002},
    {"id": 6, "start_frame": 82077, "end_frame": 94127, "confidence": 0.29999999999999999},
    {"id": 7, "start_frame": 91634, "end_frame": 113031, "confidence": 0.65000000000000002},
    {"id": 8, "start_frame": 98440, "end_frame": 113031, "confidence": 0.65000000000000002},
    {"id": 9, "start_frame": 102222, "end_frame": 113547, "confidence": 0.65000000000000002},
    {"id": 10, "start_frame": 118947, "end_frame": 143717, "confidence": 0.65000000000000002},
    {"id": 11, "start_frame": 123890, "end_frame": 143717, "confidence": 0.65000000000000002},
    {"id": 12, "start_frame": 128225, "end_frame": 143717, "confidence": 0.65000000000000002}
  ],
  "voice_events": [
    {"start_tick": 7680, "clip_id": 0, "gain_db": -3, "rate": 1, "reverse": false, "pan": 0, "clean": true},
    {"start_tick": 15360, "clip_id": 5, "gain_db": -7, "rate": 1, "reverse": false, "pan": -0.25, "clean": false},
    {"start_tick": 16818, "clip_id": 6, "gain_db": -7, "rate": 1, "reverse": false, "pan": 0.25, "clean": false},
    {"start_tick": 23040, "clip_id": 0, "gain_db": -4, "rate": 1, "reverse": false, "pan": 0, "clean": true},
    {"start_tick": 30720, "clip_id": 9, "gain_db": -7, "rate": 1, "reverse": false, "pan": -0.25, "clean": false},
    {"start_tick": 32178, "clip_id": 10, "gain_db": -7, "rate": 1, "reverse": false, "pan": 0.25, "clean": false},
    {"start_tick": 38400, "clip_id": 11, "gain_db": -7, "rate": 1, "reverse": false, "pan": -0.25, "clean": false},
    {"start_tick": 39858, "clip_id": 12, "gain_db": -7, "rate": 1, "reverse": false, "pan": 0.25, "clean": false}
  ],
  "tracks": [
    {"instrument": "piano", "gain_db": -10, "pan": -0.20000000000000001, "events": [
      {"start_tick": 0, "duration_ticks": 3110, "note": 57, "velocity": 50},
      {"start_tick": 12, "duration_ticks": 3097, "note": 62, "velocity": 49},
      {"start_tick": 24, "duration_ticks": 3084, "note": 65, "velocity": 54},
      {"start_tick": 3840, "duration_ticks": 3110, "note": 57, "velocity": 51},
      {"start_tick": 3852, "duration_ticks": 3097, "note": 62, "velocity": 55},
      {"start_tick": 3864, "duration_ticks": 3084, "note": 65, "velocity": 59},
      {"start_tick": 7680, "duration_ticks": 778, "note": 57, "velocity": 77},
      {"start_tick": 7692, "duration_ticks": 765, "note": 62, "velocity": 72},
      {"start_tick": 7704, "duration_ticks": 752, "note": 65, "velocity": 84},
      {"start_tick": 9840, "duration_ticks": 518, "note": 57, "velocity": 58},
      {"start_tick": 9852, "duration_ticks": 505, "note": 62, "velocity": 63},
      {"start_tick": 9864, "duration_ticks": 492, "note": 65, "velocity": 62},
      {"start_tick": 11520, "duration_ticks": 778, "note": 55, "velocity": 74},
      {"start_tick": 11532, "duration_ticks": 765, "note": 60, "velocity": 70},
      {"start_tick": 11544, "duration_ticks": 752, "note": 64, "velocity": 81},
      {"start_tick": 13680, "duration_ticks": 518, "note": 55, "velocity": 58},
      {"start_tick": 13692, "duration_ticks": 505, "note": 60, "velocity": 56},
      {"start_tick": 13704, "duration_ticks": 492, "note": 64, "velocity": 65},
      {"start_tick": 11520, "duration_ticks": 778, "note": 67, "velocity": 67},
      {"start_tick": 12978, "duration_ticks": 778, "note": 72, "velocity": 63},
      {"start_tick": 15360, "duration_ticks": 778, "note": 58, "velocity": 71},
      {"start_tick": 15372, "duration_ticks": 765, "note": 62, "velocity": 68},
      {"start_tick": 15384, "duration_ticks": 752, "note": 65, "velocity": 81},
      {"start_tick": 17520, "duration_ticks": 518, "note": 58, "velocity": 59},
      {"start_tick": 17532, "duration_ticks": 505, "note": 62, "velocity": 49},
      {"start_tick": 17544, "duration_ticks": 492, "note": 65, "velocity": 57},
      {"start_tick": 19200, "duration_ticks": 778, "note": 58, "velocity": 69},
      {"start_tick": 19212, "duration_ticks": 765, "note": 62, "velocity": 68},
      {"start_tick": 19224, "duration_ticks": 752, "note": 67, "velocity": 80},
      {"start_tick": 21360, "duration_ticks": 518, "note": 58, "velocity": 58},
      {"start_tick": 21372, "duration_ticks": 505, "note": 62, "velocity": 60},
      {"start_tick": 21384, "duration_ticks": 492, "note": 67, "velocity": 69},
      {"start_tick": 19200, "duration_ticks": 778, "note": 70, "velocity": 69},
      {"start_tick": 20658, "duration_ticks": 778, "note": 74, "velocity": 70},
      {"start_tick": 23040, "duration_ticks": 3110, "note": 57, "velocity": 42},
      {"start_tick": 23052, "duration_ticks": 3097, "note": 62, "velocity": 49},
      {"start_tick": 23064, "duration_ticks": 3084, "note": 65, "velocity": 57},
      {"start_tick": 26880, "duration_ticks": 3110, "note": 55, "velocity": 39},
      {"start_tick": 26892, "duration_ticks": 3097, "note": 60, "velocity": 42},
      {"start_tick": 26904, "duration_ticks": 3084, "note": 64, "velocity": 46},
      {"start_tick": 30720, "duration_ticks": 778, "note": 57, "velocity": 72},
      {"start_tick": 30732, "duration_ticks": 765, "note": 62, "velocity": 68},
      {"start_tick": 30744, "duration_ticks": 752, "note": 65, "velocity": 74},
      {"start_tick": 32880, "duration_ticks": 518, "note": 57, "velocity": 63},
      {"start_tick": 32892, "duration_ticks": 505, "note": 62, "velocity": 58},
      {"start_tick": 32904, "duration_ticks": 492, "note": 65, "velocity": 71},
      {"start_tick": 34560, "duration_ticks": 778, "note": 55, "velocity": 69},
      {"start_tick": 34572, "duration_ticks": 765, "note": 60, "velocity": 68},
      {"start_tick": 34584, "duration_ticks": 752, "note": 64, "velocity": 76},
      {"start_tick": 36720, "duration_ticks": 518, "note": 55, "velocity": 60},
      {"start_tick": 36732, "duration_ticks": 505, "note": 60, "velocity": 68},
      {"start_tick": 36744, "duration_ticks": 492, "note": 64, "velocity": 75},
      {"start_tick": 34560, "duration_ticks": 778, "note": 72, "velocity": 62},
      {"start_tick": 36018, "duration_ticks": 778, "note": 76, "velocity": 65},
      {"start_tick": 38400, "duration_ticks": 778, "note": 58, "velocity": 77},
      {"start_tick": 38412, "duration_ticks": 765, "note": 62, "velocity": 76},
      {"start_tick": 38424, "duration_ticks": 752, "note": 65, "velocity": 85},
      {"start_tick": 40560, "duration_ticks": 518, "note": 58, "velocity": 65},
      {"start_tick": 40572, "duration_ticks": 505, "note": 62, "velocity": 65},
      {"start_tick": 40584, "duration_ticks": 492, "note": 65, "velocity": 77},
      {"start_tick": 42240, "duration_ticks": 3110, "note": 57, "velocity": 74},
      {"start_tick": 42252, "duration_ticks": 3097, "note": 62, "velocity": 74},
      {"start_tick": 42264, "duration_ticks": 3084, "note": 65, "velocity": 80}
    ]},
    {"instrument": "bass", "gain_db": -8, "pan": 0, "events": [
      {"start_tick": 7680, "duration_ticks": 662, "note": 38, "velocity": 99},
      {"start_tick": 8880, "duration_ticks": 442, "note": 45, "velocity": 78},
      {"start_tick": 10098, "duration_ticks": 883, "note": 50, "velocity": 94},
      {"start_tick": 11520, "duration_ticks": 662, "note": 36, "velocity": 100},
      {"start_tick": 12720, "duration_ticks": 442, "note": 43, "velocity": 77},
      {"start_tick": 13938, "duration_ticks": 883, "note": 48, "velocity": 80},
      {"start_tick": 15360, "duration_ticks": 662, "note": 34, "velocity": 104},
      {"start_tick": 16560, "duration_ticks": 442, "note": 41, "velocity": 74},
      {"start_tick": 17778, "duration_ticks": 883, "note": 46, "velocity": 86},
      {"start_tick": 19200, "duration_ticks": 662, "note": 31, "velocity": 99},
      {"start_tick": 20400, "duration_ticks": 442, "note": 38, "velocity": 79},
      {"start_tick": 21618, "duration_ticks": 883, "note": 43, "velocity": 86},
      {"start_tick": 30720, "duration_ticks": 662, "note": 38, "velocity": 96},
      {"start_tick": 31920, "duration_ticks": 442, "note": 45, "velocity": 80},
      {"start_tick": 33138, "duration_ticks": 883, "note": 50, "velocity": 88},